{
  "schema_version": 1,
  "generic": [
    {
      "id": "marketing-copy",
      "languages": [
        "*"
      ],
      "usecases": [
        "marketing",
        "ads",
        "social"
      ],
      "file": "references/techniques/marketing-copy.md"
    },
    {
      "id": "humanize-workflow",
      "languages": [
        "*"
      ],
      "usecases": [
        "humanize"
      ],
      "file": "references/techniques/humanize-workflow.md"
    },
    {
      "id": "flow-by-relation",
      "languages": [
        "*"
      ],
      "usecases": [
        "*"
      ],
      "file": "references/techniques/flow-by-relation.md",
      "note": "Also load on review when development/flow breaks; humanize when list-like"
    },
    {
      "id": "natural-writing",
      "languages": [
        "*"
      ],
      "usecases": [
        "*"
      ],
      "file": "references/techniques/natural-writing.md"
    },
    {
      "id": "translation-vs-voice",
      "languages": [
        "*"
      ],
      "usecases": [
        "*"
      ],
      "file": "references/techniques/translation-vs-voice.md"
    },
    {
      "id": "jp-marketing-stub",
      "languages": [
        "japanese"
      ],
      "usecases": [
        "marketing",
        "ads",
        "social"
      ],
      "file": "references/techniques/jp-marketing.md",
      "note": "Stub — prefer locales/japanese.md"
    }
  ],
  "generic_usecase": [
    {
      "id": "email-comms",
      "languages": [
        "*"
      ],
      "usecases": [
        "email",
        "letter",
        "announcement"
      ],
      "file": "references/techniques/email-comms.md"
    },
    {
      "id": "chat-comms",
      "languages": [
        "*"
      ],
      "usecases": [
        "chat"
      ],
      "file": "references/techniques/chat-comms.md"
    },
    {
      "id": "incident-comms",
      "languages": [
        "*"
      ],
      "usecases": [
        "incident"
      ],
      "file": "references/techniques/incident-comms.md"
    },
    {
      "id": "academic-writing",
      "languages": [
        "*"
      ],
      "usecases": [
        "academic"
      ],
      "file": "references/techniques/academic-writing.md"
    },
    {
      "id": "docs-prose",
      "languages": [
        "*"
      ],
      "usecases": [
        "docs",
        "technical-doc"
      ],
      "file": "references/techniques/docs-prose.md"
    }
  ],
  "locales": [
    {
      "id": "abui",
      "languages": [
        "abui"
      ],
      "usecases": [
        "email",
        "chat",
        "docs"
      ],
      "file": "references/techniques/locales/abui.md"
    },
    {
      "id": "afrikaans",
      "languages": [
        "afrikaans"
      ],
      "usecases": [
        "marketing",
        "ads",
        "social",
        "email",
        "chat",
        "incident",
        "docs",
        "academic"
      ],
      "file": "references/techniques/locales/afrikaans.md"
    },
    {
      "id": "albanian",
      "languages": [
        "albanian"
      ],
      "usecases": [
        "marketing",
        "ads",
        "social",
        "email",
        "chat",
        "incident",
        "docs",
        "academic"
      ],
      "file": "references/techniques/locales/albanian.md"
    },
    {
      "id": "amharic",
      "languages": [
        "amharic"
      ],
      "usecases": [
        "marketing",
        "ads",
        "social",
        "email",
        "chat",
        "incident",
        "docs",
        "academic"
      ],
      "file": "references/techniques/locales/amharic.md"
    },
    {
      "id": "arabic",
      "languages": [
        "arabic"
      ],
      "usecases": [
        "marketing",
        "email",
        "chat"
      ],
      "file": "references/techniques/locales/arabic.md"
    },
    {
      "id": "armenian",
      "languages": [
        "armenian"
      ],
      "usecases": [
        "marketing",
        "ads",
        "social",
        "email",
        "chat",
        "incident",
        "docs",
        "academic"
      ],
      "file": "references/techniques/locales/armenian.md"
    },
    {
      "id": "arz",
      "languages": [
        "arz"
      ],
      "usecases": [
        "marketing",
        "ads",
        "social",
        "email",
        "chat",
        "incident",
        "docs",
        "academic"
      ],
      "file": "references/techniques/locales/arz.md"
    },
    {
      "id": "assamese",
      "languages": [
        "assamese"
      ],
      "usecases": [
        "marketing",
        "ads",
        "social",
        "email",
        "chat",
        "incident",
        "docs",
        "academic"
      ],
      "file": "references/techniques/locales/assamese.md"
    },
    {
      "id": "azerbaijani",
      "languages": [
        "azerbaijani"
      ],
      "usecases": [
        "marketing",
        "ads",
        "social",
        "email",
        "chat",
        "incident",
        "docs",
        "academic"
      ],
      "file": "references/techniques/locales/azerbaijani.md"
    },
    {
      "id": "bali",
      "languages": [
        "bali"
      ],
      "usecases": [
        "marketing",
        "ads",
        "social",
        "email",
        "chat",
        "incident",
        "docs",
        "academic"
      ],
      "file": "references/techniques/locales/bali.md"
    },
    {
      "id": "basque",
      "languages": [
        "basque"
      ],
      "usecases": [
        "marketing",
        "ads",
        "social",
        "email",
        "chat",
        "incident",
        "docs",
        "academic"
      ],
      "file": "references/techniques/locales/basque.md"
    },
    {
      "id": "bengali",
      "languages": [
        "bengali"
      ],
      "usecases": [
        "marketing",
        "ads",
        "social",
        "email",
        "chat",
        "incident",
        "docs",
        "academic"
      ],
      "file": "references/techniques/locales/bengali.md"
    },
    {
      "id": "bosnian",
      "languages": [
        "bosnian"
      ],
      "usecases": [
        "marketing",
        "ads",
        "social",
        "email",
        "chat",
        "incident",
        "docs",
        "academic"
      ],
      "file": "references/techniques/locales/bosnian.md"
    },
    {
      "id": "bulgarian",
      "languages": [
        "bulgarian"
      ],
      "usecases": [
        "marketing",
        "ads",
        "social",
        "email",
        "chat",
        "incident",
        "docs",
        "academic"
      ],
      "file": "references/techniques/locales/bulgarian.md"
    },
    {
      "id": "burmese",
      "languages": [
        "burmese"
      ],
      "usecases": [
        "marketing",
        "ads",
        "social",
        "email",
        "chat",
        "incident",
        "docs",
        "academic"
      ],
      "file": "references/techniques/locales/burmese.md"
    },
    {
      "id": "cantonese",
      "languages": [
        "cantonese"
      ],
      "usecases": [
        "marketing",
        "ads",
        "social",
        "email",
        "chat",
        "incident",
        "docs",
        "academic"
      ],
      "file": "references/techniques/locales/cantonese.md"
    },
    {
      "id": "catalan",
      "languages": [
        "catalan"
      ],
      "usecases": [
        "marketing",
        "ads",
        "social",
        "email",
        "chat",
        "incident",
        "docs",
        "academic"
      ],
      "file": "references/techniques/locales/catalan.md"
    },
    {
      "id": "croatian",
      "languages": [
        "croatian"
      ],
      "usecases": [
        "marketing",
        "ads",
        "social",
        "email",
        "chat",
        "incident",
        "docs",
        "academic"
      ],
      "file": "references/techniques/locales/croatian.md"
    },
    {
      "id": "czech",
      "languages": [
        "czech"
      ],
      "usecases": [
        "marketing",
        "ads",
        "social",
        "email",
        "chat",
        "incident",
        "docs",
        "academic"
      ],
      "file": "references/techniques/locales/czech.md"
    },
    {
      "id": "danish",
      "languages": [
        "danish"
      ],
      "usecases": [
        "marketing",
        "ads",
        "social",
        "email",
        "chat",
        "incident",
        "docs",
        "academic"
      ],
      "file": "references/techniques/locales/danish.md"
    },
    {
      "id": "dayak",
      "languages": [
        "dayak"
      ],
      "usecases": [
        "marketing",
        "ads",
        "social",
        "email",
        "chat",
        "incident",
        "docs",
        "academic"
      ],
      "file": "references/techniques/locales/dayak.md"
    },
    {
      "id": "dayak-ngaju",
      "languages": [
        "dayak-ngaju"
      ],
      "usecases": [
        "email",
        "chat",
        "docs"
      ],
      "file": "references/techniques/locales/dayak-ngaju.md"
    },
    {
      "id": "dutch",
      "languages": [
        "dutch"
      ],
      "usecases": [
        "marketing",
        "ads",
        "social",
        "email",
        "chat",
        "incident",
        "docs",
        "academic"
      ],
      "file": "references/techniques/locales/dutch.md"
    },
    {
      "id": "english",
      "languages": [
        "english"
      ],
      "usecases": [
        "marketing",
        "ads",
        "social",
        "email",
        "chat",
        "incident",
        "docs",
        "academic"
      ],
      "file": "references/techniques/locales/english.md"
    },
    {
      "id": "esperanto",
      "languages": [
        "esperanto"
      ],
      "usecases": [
        "marketing",
        "ads",
        "social",
        "email",
        "chat",
        "incident",
        "docs",
        "academic"
      ],
      "file": "references/techniques/locales/esperanto.md"
    },
    {
      "id": "estonian",